{
  "story_id": "shandong_1994",
  "chapter_id": "CH02",
  "project_id": "shandong_1994_ch02",
  "title": "山东小孩·平凡前半生",
  "style_lock": "live_action",
  "resolution": "768p横",
  "video_workflow": "manhua_video_ref",
  "steps": [
    "video"
  ],
  "script": {
    "logline": "平凡第一次离开村庄走进镇小学，在陌生与拘谨中找到属于自己的座位。",
    "synopsis": "第二章\n\n天还没有完全亮，母亲已经把平凡叫醒。灶膛里的火刚烧起来，屋里仍旧冷着。她把一块热煎饼用白布包好，塞进平凡的书包侧袋，又替他把衣领翻平。父亲站在院门口，借着昏暗的天光看了看车来的方向。\n\n村口的早班车带着一身夜里的湿气停下，车门一开，里面便涌出柴油味和许多人的说话声。平凡跟着母亲上车，找了个靠窗的位置坐下。母亲把他的书包抱到腿上，直到车子开动，才递还给他。\n\n土路很快接上了柏油路。车窗玻璃上蒙着一层薄薄的雾气，平凡用袖口擦出一小块地方。天边刚泛白，田里的麦苗还带着露水，整齐地铺在路两旁。低矮的院墙、冒着炊烟的屋顶、村口那棵歪脖子杨树，一样一样往后退去。平凡看着它们变小，手指一直压在书包的蓝色帆布边上。\n\n到了镇上，街道已经有了卖早点的摊子，蒸笼冒出的白气遮住了半条路。镇小学的校门比村里的宽，门柱上刷着白漆，院墙里面是一栋青砖教学楼。上课铃不是人敲出来的，而是挂在楼顶的电铃，声音尖亮，传得很远。\n\n母亲领着平凡到教导处报到。老师翻了翻登记册，把他的名字念了一遍，让他下午按时来上课。母亲点头道谢，又低头叮嘱他：“听老师的话，别乱跑。”平凡轻轻应了一声。\n\n进教室时，里面已经坐了不少学生。他们有的穿着干净的新衣服，有的背着印着卡通图案的书包，彼此说着平凡听不太懂的话。老师让他站到讲台前，向大家介绍自己。\n\n平凡攥着衣角，说：“我叫平凡，来自东边的村子。”\n\n声音落下去，教室里短暂地安静了一下。老师让他回座位，他便低着头走到最后一排。课间，其他孩子很快跑到操场上，有人在追逐，有人在围着跳绳，还有几个男生蹲在墙根谈着游戏。平凡没有过去，只一个人站在走廊尽头，手扶着冰凉的栏杆，看那些陌生的身影在阳光里来回移动。\n\n第二节课前，老师把他调到靠窗的位置。窗外是一排刚栽下不久的小树，枝条细细的，风一吹便轻轻晃动。平凡坐下，打开桌斗，里面空空的，只有木板上留下的铅笔划痕。他把蓝色帆布书包小心地放进去，又把露在外面的肩带往里收了收。电铃声再次响起，他抬头看了一眼窗外，翻开了面前的新课本。\n\n平凡在母亲陪伴下坐上开往镇上的早班车，隔着蒙雾的车窗回望逐渐远去的村庄。到达镇小学后，母亲带他完成报到，老师让他向同学介绍自己。平凡因陌生而低头小声开口，课间独自站在走廊尽头。第二节课前，老师将他调到靠窗的位置，他把蓝色帆布书包收进桌斗，翻开新课本，安静地开始了镇小学的第一堂课。",
    "episodes": [
      {
        "episode_id": "E01",
        "title": "第一次走进镇小学",
        "summary": "天未亮，平凡在母亲陪伴下坐上开往镇上的早班车。离开熟悉的村庄后，他在镇小学完成报到，拘谨地介绍自己，并在课间独自站在走廊尽头。第二节课前，老师将他安排到靠窗的位置，他安静地打开课本，开始面对新的校园生活。",
        "beats": [
          {
            "beat_id": "E01_B01",
            "scene_id": "E05",
            "summary": "早班车停在村口，母亲将书包递给平凡，目送他坐到靠窗的位置。",
            "emotion": "克制的不舍与紧张"
          },
          {
            "beat_id": "E01_B02",
            "scene_id": "E02",
            "summary": "车子驶离村庄，平凡擦开车窗上的雾气，回望麦田、院墙与歪脖子杨树。",
            "emotion": "陌生中的留恋"
          },
          {
            "beat_id": "E01_B03",
            "scene_id": "E03",
            "summary": "母亲带平凡到镇小学报到，老师翻看点名册并交代下午按时上课。",
            "emotion": "拘谨与认真"
          },
          {
            "beat_id": "E01_B04",
            "scene_id": "E03",
            "summary": "老师让平凡向同学介绍自己，他低头攥着衣角，小声说出自己的名字和来处。",
            "emotion": "羞怯与不安"
          },
          {
            "beat_id": "E01_B05",
            "scene_id": "E03",
            "summary": "课间平凡独自站在走廊尽头，随后被老师调到靠窗座位，收好书包并翻开新课本。",
            "emotion": "孤单中的安定"
          }
        ]
      }
    ]
  },
  "characters": [
    {
      "id": "C01",
      "name": "平凡",
      "role": "主角",
      "identity_lock": "1994年山东济宁农村男孩，约7岁，圆脸，眉毛较细，黑色大眼睛，鼻梁平直，嘴唇偏薄，肤色自然偏麦色；黑色短发，发梢略显凌乱，额前有几缕碎发；身材瘦小；固定穿洗旧的灰蓝色棉布上衣、深蓝色长裤、旧布鞋，背蓝色帆布书包。性格安静内向，见生人时习惯低头或躲到母亲身后。所有分镜中保持同一年龄、五官、发型与服装识别特征，不改变为其他人物或年龄阶段。",
      "sheet_prompt": "1994年中国山东济宁农村，7岁安静男孩，圆脸，细眉，黑色大眼睛，平直鼻梁，薄嘴唇，麦色皮肤，黑色凌乱短发，瘦小身材，灰蓝色旧棉布上衣，深蓝色长裤，旧布鞋，蓝色帆布书包，真人写实影视风，生活化比例，自然光影，live_action",
      "approved": true,
      "ref_images": {
        "sheet": "https://litter.catbox.moe/qsng9x.png"
      }
    },
    {
      "id": "C02",
      "name": "平凡的母亲",
      "role": "关键配角",
      "identity_lock": "1994年山东济宁农村中年女性，约32岁， oval脸型，眉眼温和，黑色眼睛，鼻梁小巧，嘴角自然下垂，肤色偏黄；黑色长发在脑后低低束成发髻，鬓角有少量碎发；身材朴实结实；固定穿深色小碎花棉袄、黑色宽腿裤、黑色布鞋，做家务时外系深蓝色围裙。性格勤劳、克制、温柔而坚定。所有分镜中保持同一五官、发型与服装识别特征。",
      "sheet_prompt": "1994年中国山东济宁农村母亲，32岁，温和椭圆脸，黑色眼睛，小巧鼻梁，黑色长发低发髻，朴实结实体型，深色小碎花棉袄，黑色宽腿裤，黑色布鞋，深蓝色围裙，真人写实影视风，live_action",
      "approved": true,
      "ref_images": {
        "sheet": "https://litter.catbox.moe/nbn4ir.png"
      }
    },
    {
      "id": "C03",
      "name": "平凡的父亲",
      "role": "关键配角",
      "identity_lock": "1994年山东济宁农村中年男性，约35岁，方脸，浓眉，深黑色眼睛，鼻梁较宽，嘴唇偏厚，肤色黝黑，脸颊有日晒痕迹；黑色短发，发际线略高；身材结实偏瘦，肩膀宽；固定穿褪色蓝色工装外套、灰色粗布裤、黑色布鞋，干农活时袖口挽起。性格少言、勤劳、谨慎，常以沉默表达压力。所有分镜中保持同一五官、发型与服装识别特征。",
      "sheet_prompt": "1994年中国山东济宁农村父亲，35岁，方脸，浓眉，深黑眼睛，宽鼻梁，黝黑皮肤，黑色短发，发际线略高，结实偏瘦体型，褪色蓝色工装外套，灰色粗布裤，黑色布鞋，真人写实影视风，live_action",
      "approved": true,
      "ref_images": {
        "sheet": "https://litter.catbox.moe/049pvk.png"
      }
    },
    {
      "id": "C04",
      "name": "村小学老师",
      "role": "配角",
      "identity_lock": "1994年山东济宁农村小学女教师，约28岁，鹅蛋脸，细眉，黑色眼睛，鼻梁秀气，黑色齐耳短发，身材清瘦；固定穿米白色衬衫、深灰色针织背心、深色长裙和黑色布鞋，手持粉笔或点名册。气质耐心朴素。所有分镜中保持同一五官、发型与服装识别特征。",
      "sheet_prompt": "1994年山东济宁农村小学女教师，28岁，鹅蛋脸，细眉，黑色齐耳短发，米白衬衫，深灰针织背心，深色长裙，黑色布鞋，手持粉笔和点名册，真人写实影视风，live_action",
      "approved": true,
      "ref_images": {
        "sheet": "https://litter.catbox.moe/mv1gce.png"
      }
    }
  ],
  "environments": [
    {
      "id": "E01",
      "name": "平凡家院与灶房",
      "scene_card": "山东济宁农村土坯院落，低矮砖房，灶房门口有煤炉和黑色铁锅，墙边堆着玉米秸秆，门槛磨损，院中摆着旧木凳，生活痕迹浓厚。",
      "time_of_day": "傍晚",
      "weather": "晴朗闷热，空气中有夏蝉声",
      "ref_images": {
        "establishing": "https://litter.catbox.moe/zd3n56.png"
      }
    },
    {
      "id": "E02",
      "name": "村边麦田",
      "scene_card": "济宁农村村边土路与麦田，田埂狭窄，远处有稀疏杨树和低矮村屋，泥土路上留有车辙，整体开阔而朴素。",
      "time_of_day": "春日下午",
      "weather": "晴天，微风，阳光柔和",
      "ref_images": {
        "establishing": "https://litter.catbox.moe/zd3n56.png"
      }
    },
    {
      "id": "E03",
      "name": "村小学教室与操场",
      "scene_card": "1994年农村小学，低矮砖瓦校舍，黄土地操场，黑板边缘掉漆，木课桌排列整齐，窗框陈旧，墙上有手绘课程表。",
      "time_of_day": "上午",
      "weather": "晴朗，阳光从旧窗户斜射进教室",
      "ref_images": {
        "establishing": "https://litter.catbox.moe/zd3n56.png"
      }
    },
    {
      "id": "E04",
      "name": "夜间灶房",
      "scene_card": "狭窄灶房，煤炉余火泛红，墙面被烟熏成灰黑色，灶台后藏着一个旧铁盒，桌面上有搪瓷碗和几张零钱，光线主要来自煤炉与昏黄灯泡。",
      "time_of_day": "深夜",
      "weather": "屋外寒凉，无雨",
      "ref_images": {
        "establishing": "https://litter.catbox.moe/zd3n56.png"
      }
    },
    {
      "id": "E05",
      "name": "村口土路",
      "scene_card": "山东农村村口，土路从院落之间延伸到远方，路旁有老槐树、电线杆和低矮土墙，远处隐约可见通往镇上的公路与早班车方向。",
      "time_of_day": "清晨",
      "weather": "秋日薄雾，微凉，天色刚亮",
      "ref_images": {
        "establishing": "https://litter.catbox.moe/zd3n56.png"
      }
    }
  ],
  "props": [
    {
      "id": "P01",
      "name": "蓝色帆布书包",
      "clue_lock": "1994年农村孩子使用的旧式蓝色帆布双肩书包，边角略磨白，正面有一块浅色布补丁，书包带稍宽，始终作为平凡走向学校和村口的重要视觉线索。",
      "ref_images": {}
    },
    {
      "id": "P02",
      "name": "旧铁盒与零钱",
      "clue_lock": "灶台后藏着的椭圆形旧铁盒，深绿色掉漆，盒盖有轻微凹痕，里面是一沓一角、五角和一元纸币及少量硬币，代表母亲数月积攒的车费。",
      "ref_images": {}
    },
    {
      "id": "P03",
      "name": "点名册与粉笔",
      "clue_lock": "村小学老师使用的褐色硬皮点名册和短短的白色粉笔，用于表现平凡第一次在课堂上小声回答“到”。",
      "ref_images": {}
    }
  ],
  "shots": [
    {
      "shot_id": "E01_S01_SH01",
      "episode_id": "E01",
      "scene_id": "E05",
      "beat_id": "E01_B01",
      "environment_id": "E05",
      "character_ids": [
        "C01",
        "C02"
      ],
      "prop_ids": [
        "P01"
      ],
      "duration": 5,
      "camera": {
        "shot_size": "中远景",
        "angle": "平视",
        "move": "横屏固定机位，早班车驶入后缓慢向右摇摄"
      },
      "action": "早班车停下，母亲扶平凡上车并将蓝色帆布书包递给他，平凡回头看母亲一眼后走向靠窗座位，情绪克制而紧张",
      "dialogue": "母亲：到了镇上，听老师的话。平凡：嗯。",
      "emotion": "克制的不舍与紧张",
      "plan_path": "video_ref",
      "still_approved": true,
      "needs_lipsync": false
    },
    {
      "shot_id": "E01_S02_SH01",
      "episode_id": "E01",
      "scene_id": "E02",
      "beat_id": "E01_B02",
      "environment_id": "E02",
      "character_ids": [
        "C01"
      ],
      "prop_ids": [
        "P01"
      ],
      "duration": 5,
      "camera": {
        "shot_size": "近景转主观中景",
        "angle": "侧面平视",
        "move": "从平凡的手部缓慢推向车窗，再跟随窗外景物横向移动"
      },
      "action": "平凡用袖口擦开车窗雾气，手指压住书包边缘，透过小块清晰的玻璃回望麦田、院墙和远处的杨树，车身持续前行",
      "dialogue": "",
      "emotion": "陌生中的留恋",
      "plan_path": "video_ref",
      "still_approved": true,
      "needs_lipsync": false
    },
    {
      "shot_id": "E01_S03_SH01",
      "episode_id": "E01",
      "scene_id": "E03",
      "beat_id": "E01_B03",
      "environment_id": "E03",
      "character_ids": [
        "C01",
        "C02",
        "C04"
      ],
      "prop_ids": [
        "P01",
        "P03"
      ],
      "duration": 5,
      "camera": {
        "shot_size": "中景",
        "angle": "平视",
        "move": "横屏缓慢横移，从母亲与平凡移动到老师和点名册"
      },
      "action": "母亲陪平凡站在教室门口，老师翻开点名册确认姓名并指向教室座位，平凡轻轻点头，镜头保持安静移动",
      "dialogue": "老师：平凡，下午按时来上课。母亲：哎，谢谢老师。",
      "emotion": "拘谨与认真",
      "plan_path": "video_ref",
      "still_approved": true,
      "needs_lipsync": false
    },
    {
      "shot_id": "E01_S04_SH01",
      "episode_id": "E01",
      "scene_id": "E03",
      "beat_id": "E01_B04",
      "environment_id": "E03",
      "character_ids": [
        "C01",
        "C04"
      ],
      "prop_ids": [
        "P01",
        "P03"
      ],
      "duration": 5,
      "camera": {
        "shot_size": "中近景",
        "angle": "略低于平视",
        "move": "从老师肩后缓慢推近平凡，停在他的上半身与攥紧的手部"
      },
      "action": "老师示意平凡面对教室，平凡低头攥住衣角，短暂抬眼后小声开口，教室里的动静渐渐安静下来",
      "dialogue": "平凡：我叫平凡，来自东边的村子。",
      "emotion": "羞怯与不安",
      "plan_path": "video_ref",
      "still_approved": true,
      "needs_lipsync": false
    },
    {
      "shot_id": "E01_S05_SH01",
      "episode_id": "E01",
      "scene_id": "E03",
      "beat_id": "E01_B05",
      "environment_id": "E03",
      "character_ids": [
        "C01",
        "C04"
      ],
      "prop_ids": [
        "P01"
      ],
      "duration": 5,
      "camera": {
        "shot_size": "中景转近景",
        "angle": "平视",
        "move": "先沿走廊缓慢跟拍，再切至靠窗座位并轻微推近课本"
      },
      "action": "平凡独自扶着走廊栏杆看向操场，老师示意他坐到靠窗位置；他收好书包肩带，打开新课本，窗外细树枝条轻轻晃动",
      "dialogue": "老师：你坐这儿吧。平凡：好。",
      "emotion": "孤单中的安定",
      "plan_path": "video_ref",
      "still_approved": true,
      "needs_lipsync": false
    }
  ]
}